{
  "$schema": "https://json-schema.org/draft/2020-12/schema",
  "description": "model.json described a light model",
  "type": "object",
  "required": [
    "name",
    "standby_power",
    "measure_method",
    "measure_device"
  ],
  "properties": {
    "name": {
      "type": "string",
      "description": "The full name"
    },
    "standby_power": {
      "type": "number",
      "minimum": 0.05,
      "description": "Power draw when the light is turned of. When you are not able to measure set to 0.4"
    },
    "standby_power_on": {
      "type": "number",
      "minimum": 0.05,
      "description": "Power draw when the light is turned on."
    },
    "supported_modes": {
      "type": "array",
      "items": {
        "type": "string",
        "enum": ["lut", "linear", "fixed"]
      },
      "description": "Supported calculation modes"
    },
    "measure_method": {
      "type": "string",
      "enum": ["manual", "script"],
      "description": "How the light was measured"
    },
    "measure_device": {
      "type": "string",
      "description": "Device which was used to measure"
    },
    "measure_description": {
      "type": "string",
      "description": "Add more information about how you measured the light or any remarks"
    },
    "measure_settings": {
      "type": "object",
      "description": "Settings used for measure script"
    },
    "linked_lut": {
      "type": "string",
      "description": "Use LUT data files from another model"
    },
    "requires_additional_configuration": {
      "type": "boolean",
      "description": "Defines whether this model needs additional configuration by the user. Used for smart switches and lights where we can only know the standby power, but not the power of connected light bulb"
    },
    "device_type": {
      "type": "string",
      "enum": ["light", "smart_switch"],
      "description": "Type of device"
    },
    "calculation_enabled_condition": {
      "type": "string",
      "description": "Template which can be evaluated."
    },
    "linear_config": {
      "type": "object",
      "description": "Configuration for linear calculation mode",
      "properties": {
        "min_watt": {
          "type": "number"
        },
        "max_watt": {
          "type": "number"
        }
      }
    },
    "fixed_config": {
      "type": "object",
      "description": "Configuration for fixed calculation mode",
      "properties": {
        "watt": {
          "type": "number"
        }
      }
    }
  }
}