{
    "measure_description": "Measured with utils/measure script",
    "measure_device": "Anthom, Smart Plug",
    "measure_method": "script",
    "measure_settings": {
        "SAMPLE_COUNT": 2,
        "SLEEP_TIME": 3,
        "VERSION": "master"
    },
    "name": "Candlebra",
    "standby_power": 0.4,
    "supported_modes": [
        "lut"
    ]
}