{
    "measure_description": "Measured with utils/measure script",
    "measure_device": "Shelly Plug S",
    "measure_method": "script",
    "measure_settings": {
        "SAMPLE_COUNT": 3,
        "SLEEP_TIME": 6,
        "VERSION": "master"
    },
    "name": "TRADFRI LED bulb GU10 345 lumen, dimmable, white spectrum",
    "standby_power": 0.2,
    "supported_modes": [
        "lut"
    ]
}
