{
    "measure_description": "Measured with utils/measure script",
    "measure_device": "athom, smart-plug-v2",
    "measure_method": "script",
    "measure_settings": {
        "SAMPLE_COUNT": 1,
        "SLEEP_TIME": 3,
        "VERSION": "master"
    },
    "name": "rgbww-light",
    "standby_power": 0.47,
    "supported_modes": [
        "lut"
    ]
}