{
    "measure_description": "Measured with utils/measure script",
    "measure_device": "Shelly, 1PM",
    "measure_method": "script",
    "measure_settings": {
        "SAMPLE_COUNT": 1,
        "SLEEP_TIME": 2,
        "VERSION": "v0.13.4"
    },
    "name": "TRADFRIbulbE14WSglobeopal470lm",
    "standby_power": 0.23,
    "supported_modes": [
        "lut"
    ]
}