{
    "measure_description": "Measured with utils/measure script",
    "measure_device": "Shelly Plug S",
    "measure_method": "script",
    "measure_settings": {
        "SAMPLE_COUNT": 2,
        "SLEEP_TIME": 3,
        "VERSION": "v0.22.1:docker"
    },
    "name": "TRADFRIbulbE27WWclear250lm",
    "standby_power": 0.27,
    "supported_modes": [
        "lut"
    ]
}